{
  "schema_version": "1.0",
  "doc_id": "ARCH-CONSISTENCY-BACKLOG-2026-03-01",
  "generated_at": "2026-03-01T16:30:00-03:00",
  "baseline": "head_main_vs_working_tree",
  "source_audit": "artifacts/architecture/2026-03-01-architectural-consistency-audit.md",
  "conflict_matrix_rows": [
    {
      "conflict_id": "C-01",
      "origem": "PRD(main) + Implementacao + Felix",
      "source_baselines": [
        "pr_main",
        "implementation",
        "felixcraft",
        "felix_relevant"
      ],
      "elemento": "Hierarquia documental e fonte de autoridade",
      "tipo_de_conflito": "Autoridade decisoria",
      "descricao": "A hierarquia oficial permite precedencia operacional de Felix sobre PRD/ARC/SEC, criando dupla autoridade para decisao arquitetural.",
      "severidade": "Critica",
      "risco_sistemico": "Quebra de fonte de autoridade e abertura de arquitetura paralela sem normalizacao formal.",
      "opcoes_de_resolucao": [
        "Rebaixar Felix para referencia conceitual com traceabilidade obrigatoria no PRD",
        "Manter Felix no topo e sincronizar toda mudanca no mesmo ciclo em PRD/ARC/SEC/PM/DEV"
      ],
      "recomendacao": "Rebaixar Felix para referencia conceitual e manter PRD/SEC/ARC como autoridade normativa.",
      "evidence_refs": [
        "META/DOCUMENT-HIERARCHY.md:33-50",
        "README.md:10-16",
        "workspaces/main/AGENTS.md:6-18",
        "PRD/PRD-MASTER.md:701-707"
      ],
      "linked_issue_id": "ISSUE-F8-03-04"
    },
    {
      "conflict_id": "C-02",
      "origem": "PRD(main) vs Implementacao(PM)",
      "source_baselines": [
        "pr_main",
        "implementation"
      ],
      "elemento": "Cadeia estrutural de planejamento",
      "tipo_de_conflito": "Estrutural",
      "descricao": "PRD define cadeia com Issues/Microtasks, enquanto governanca operacional ainda usa epicos/sprints/tasks sem fechamento estrutural unico.",
      "severidade": "Alta",
      "risco_sistemico": "Ambiguidade de decomposicao, perda de rastreabilidade e sobreposicao semantica de task vs issue.",
      "opcoes_de_resolucao": [
        "Canonizar cadeia PRD -> Fases -> Epicos -> Issues -> Microtasks",
        "Rebaixar formalmente microtasks e manter governanca por sprint/task"
      ],
      "recomendacao": "Canonizar cadeia com microtasks e alinhar SCRUM-GOV e ROADMAP.",
      "evidence_refs": [
        "PRD/ROADMAP.md:17-20",
        "PRD/PRD-MASTER.md:133-174",
        "PM/SCRUM-GOV.md:30-40"
      ],
      "linked_issue_id": "ISSUE-F8-02-04"
    },
    {
      "conflict_id": "C-03",
      "origem": "PRD(main) vs Implementacao",
      "source_baselines": [
        "pr_main",
        "implementation"
      ],
      "elemento": "Micro-issues executaveis e trilha por microtask",
      "tipo_de_conflito": "Drift tecnico",
      "descricao": "Contrato exige trilha em runs por microtask, mas implementacao ainda esta majoritariamente issue-level em artifacts de fase.",
      "severidade": "Alta",
      "risco_sistemico": "Atomicidade e replay por microtask nao materializados na pratica.",
      "opcoes_de_resolucao": [
        "Implementar trilha minima em runs/<issue_id>/<microtask_id>",
        "Reclassificar contrato como arquitetura alvo ate haver implementacao"
      ],
      "recomendacao": "Implementar trilha minima e manter classificacao explicita de status de implementacao.",
      "evidence_refs": [
        "PRD/PRD-MASTER.md:260",
        "PRD/PRD-MASTER.md:825-826",
        "artifacts/architecture/2026-03-01-architectural-consistency-audit.md:37"
      ],
      "linked_issue_id": "ISSUE-F8-01-04"
    },
    {
      "conflict_id": "C-04",
      "origem": "PRD(working tree) vs ARC/DEV/PM",
      "source_baselines": [
        "pr_working_tree",
        "implementation"
      ],
      "elemento": "Pipeline M30 -> M14-Code -> Codex 5",
      "tipo_de_conflito": "Sobreposicao de arquitetura",
      "descricao": "Pipeline novo foi declarado no PRD working tree sem harmonizacao integral dos contratos de roteamento, papeis e decisao.",
      "severidade": "Alta",
      "risco_sistemico": "Dupla governanca tecnica e gate paralelo sem enforce unico.",
      "opcoes_de_resolucao": [
        "Rebaixar secao para proposta ate alinhamento completo",
        "Promover para norma e atualizar ARC/DEV/PM/.github no mesmo ciclo"
      ],
      "recomendacao": "Manter como proposta ate harmonizacao de contratos e checks.",
      "evidence_refs": [
        "PRD/PRD-MASTER.md:696-858",
        "PRD/CHANGELOG.md:32-63",
        "ARC/ARC-MODEL-ROUTING.md:106-126",
        "PM/DECISION-PROTOCOL.md:26-55"
      ],
      "linked_issue_id": "ISSUE-F8-03-06"
    },
    {
      "conflict_id": "C-05",
      "origem": "PRD(working tree) vs Implementacao(.github)",
      "source_baselines": [
        "pr_working_tree",
        "implementation"
      ],
      "elemento": "PR governance, branch policy e ownership",
      "tipo_de_conflito": "Governanca",
      "descricao": "Regras de ownership e branch model foram ampliadas no discurso, mas precisam permanecer explicitamente enforceadas por policy e checks.",
      "severidade": "Alta",
      "risco_sistemico": "Ambiguidade de merge policy e risco de bypass em release governado.",
      "opcoes_de_resolucao": [
        "Formalizar CODEOWNERS e policy de branch com enforcement",
        "Remover do PRD qualquer dependencia normativa nao implementada"
      ],
      "recomendacao": "Manter enforcement por CODEOWNERS e policy de branch com checker dedicado.",
      "evidence_refs": [
        ".github/CODEOWNERS",
        "DEV/DEV-CI-RULES.md",
        "scripts/ci/check_pr_governance.sh",
        "PRD/PRD-MASTER.md:764-786"
      ],
      "linked_issue_id": "ISSUE-F8-03-05"
    },
    {
      "conflict_id": "C-06",
      "origem": "Felix vs Implementacao normativa",
      "source_baselines": [
        "felixcraft",
        "felix_relevant",
        "implementation"
      ],
      "elemento": "Superficies externas nao formalizadas",
      "tipo_de_conflito": "Drift conceitual",
      "descricao": "Felix e env example mencionam superficies alem do pacote de integracoes normativas, exigindo classificacao governada.",
      "severidade": "Media",
      "risco_sistemico": "Dependencias externas implicitas e aumento de superficie sem ownership contratual claro.",
      "opcoes_de_resolucao": [
        "Formalizar integracoes ativas em INTEGRATIONS",
        "Declarar superficies como fora de escopo normativo do OpenClaw atual"
      ],
      "recomendacao": "Classificar superficies como governadas ou fora de escopo por contrato.",
      "evidence_refs": [
        "felix-openclaw-pontos-relevantes.md:196-240",
        "config/openclaw.env.example:58-163",
        "INTEGRATIONS/README.md:12-20"
      ],
      "linked_issue_id": "ISSUE-F8-02-05"
    }
  ],
  "drift_rows": [
    {
      "drift_id": "D-MAIN-01",
      "bloco": "drift_do_estado_commitado",
      "source_baselines": [
        "pr_main",
        "implementation",
        "felixcraft"
      ],
      "topico": "Fonte de autoridade",
      "prd_main": "PRD registra precedencia alta de Felix em pontos de governanca.",
      "prd_working_tree": "Mantem precedencia e adiciona secao de pipeline multi-modelo.",
      "implementacao": "META, README e AGENTS ainda apresentam Felix como referencia superior.",
      "felix": "Felix continua abrangente e operacional, sem limitação normativa explicita.",
      "classe": "Critico",
      "justificativa": "Modelo de autoridade fica ambigup e pode permitir override fora de fluxo formal.",
      "evidence_refs": [
        "PRD/PRD-MASTER.md:701-707",
        "META/DOCUMENT-HIERARCHY.md:33-50",
        "README.md:10-16"
      ],
      "linked_issue_id": "ISSUE-F8-03-04"
    },
    {
      "drift_id": "D-MAIN-02",
      "bloco": "drift_do_estado_commitado",
      "source_baselines": [
        "pr_main",
        "implementation"
      ],
      "topico": "Cadeia de planejamento",
      "prd_main": "PRD reforca Issue -> Microtask e alias micro-issue.",
      "prd_working_tree": "Refina alias Micro-issue executavel = Microtask.",
      "implementacao": "SCRUM-GOV e operacao diaria ainda preservam termos sprint/task.",
      "felix": "Felix opera por loops e checklists sem cadeia estrutural equivalente.",
      "classe": "Alto",
      "justificativa": "Tres dialetos de planejamento coexistem e elevam custo de manutencao.",
      "evidence_refs": [
        "PRD/PRD-MASTER.md:133-174",
        "PM/SCRUM-GOV.md:30-40",
        "artifacts/architecture/2026-03-01-architectural-consistency-audit.md:49"
      ],
      "linked_issue_id": "ISSUE-F8-02-04"
    },
    {
      "drift_id": "D-MAIN-03",
      "bloco": "drift_do_estado_commitado",
      "source_baselines": [
        "pr_main",
        "implementation"
      ],
      "topico": "Microtask evidence path",
      "prd_main": "Contrato explicita trilha de runs por microtask.",
      "prd_working_tree": "Manteve requirement de runs e reviews por microtask.",
      "implementacao": "Nao existe trilha canonica runs materializada no repositorio.",
      "felix": "Modelo conceitual foca operacao, nao define trilha local de runs no repo.",
      "classe": "Alto",
      "justificativa": "Contrato declarado sem trilha minima executavel.",
      "evidence_refs": [
        "PRD/PRD-MASTER.md:260",
        "PRD/PRD-MASTER.md:826",
        "artifacts/architecture/2026-03-01-architectural-consistency-audit.md:37"
      ],
      "linked_issue_id": "ISSUE-F8-01-04"
    },
    {
      "drift_id": "D-MAIN-04",
      "bloco": "drift_do_estado_commitado",
      "source_baselines": [
        "pr_main",
        "implementation",
        "felix_relevant"
      ],
      "topico": "Integracoes externas",
      "prd_main": "Pacote normativo de integracoes e limitado.",
      "prd_working_tree": "Nao expande formalmente o pacote de integracoes.",
      "implementacao": "Template de env inclui superficie externa ampla.",